Title,Date,Rating,Comments
ROMA,12 May 2019,9/10,"This is a beautiful movie with a sweet and sad story done in a, to many, unusual style.There are many who don't like it. And that's fair. But that doesn't make it a bad movie. It offers something quite different than Hollywood movies which is a low key story from the common/lower ends of a Latin society. It's not about being pretentious it's about the expectations you have for a movie. If you watch movies for the plot then it likely isn't a movie for you. This is a movie about low key storytelling.It's an acquired taste much like other kinds of culture. Most people who love pop music probably wouldn't like classical music. That's not because it's bad it just doesn't live up to what they except from music. This is the case with this movie. It's not a movie that leaves you contemplating life or a lifechanging experience or a story you just have to dig deeper into, it is just the foundation of what all movies are in a sense: a story. Without all the glamour and extra things we are used to (for example there's no music to emphasise anything anywhere). The dialogue is simple, and we are simply passengers in this little story.We are just so used to movies having the classic disposition of build up point of no return climax etc with main character development or plot moving in one direction but that's not all a movie (or life) is. Sometimes stories are circular and the profound experiences that we do have end up leaving us where we began. Things change but they also don't. Life doesn't always progress forwardly, but it's always moving whether in circles, forwards or backwards.People say it's boring and I think that's wrong. It's not an exciting movie, but it's well done and it isn't boring. I can rarely watch a movie without checking my phone or getting boring but I barely blinked. I found the story to be captivating and beautiful and intriguing. This felt like a real story that could go anywhere. It was not predictable and it was well told. It isn't about that big plot twist or culmination in the end, it's just a movie moving at a slow pace which isn't trying to reach and overarch anywhere.A great and beautiful movie, but atypical and not something you should just put on to watch if you're bored. This movie is specifically not hollow entertainment and it's also not grandiose. It's low key and very simple and in many ways it's a movie without all the ""extra"" stuff which is usually used (elaborate plot, music to emphasise, classical movie split). And ironically it's because this movie is *just* a movie without all the things we're so accustomed to that it's difficult for many people to enjoy. It doesn't meet what people except of movies, but if you let go of your expectations of what a movie is or how it should be and just watch it for what it is, it's a very beautiful movie."
ROMA,17 February 2019,3/10,Typical Oscar nominee...in that the art form is everything and entertaining the viewer is forgotten . films are meant to be entertaining and that is 2 hours of my life I won't get back.Lots of long shots about nothing....just a lingering shot in which maybe a plane will fly over. Sadly nothing to hold your interest as no discernible story lines to latch onto or characters to feel something for. The film ended and I don't even realise which I guess sums it up. Think the fast forward button is the best accompaniment to this picture.If you suffer from insomnia then maybe one for you....
ROMA,18 January 2019,3/10,"I get that this movie looks good and is well directed, actors give a good performance and all that but it's a boring movie overall. You wait for something to happen but nothing that interesting actually does. If you're looking for an Arthouse type flick then maybe you'll enjoy it. Not for me. Don't believe the hype."
ROMA,12 December 2018,7/10,"I just saw ROMA at the Orpheum. I'm not too sure what to make of it just yet. I either need more time to realise more or I will stay with my initial gut feel about this film's meticulous production design and editing with extraordinarily real character portrayal.Whether I invested in those portrayals I can't yet tell you. It was like a fastidiously well edited home movie. Immersive and real but at the same time, a very narrow narrative and story.It truly does makes you feel you are living in the grit of metropolitan Mexico in 1971. The attention to detail, the background action and characters, the extreme realism transports you to another time. You can smell the smoke, dust; even the detergent that cleans the pots and dishes.If you read the crits on this film you may read that some believe this to be one the best films of the decade or some such, but the reality for me was that ROMA was more of a tea ceremony. Slow, observation and a mindful diversion. Not a narrative that I bought and that affected me.ROMA is however incredibly well made and purposeful. Though I do wonder why it was released in washed out monochrome. Like I said, I just don't know what to make of it."
ROMA,13 December 2018,7/10,"I just saw ROMA. I'm not too sure what to make of it just yet. I either need more time or I will stay with my initial gut feel about this film's meticulous production design and editing - with extraordinarily realistic character portrayal.Whether I invested in those portrayals I can't yet tell you. It was like a fastidiously well edited home movie. Immersive and real but at the same time, a very narrow narrative and story.It truly does makes you feel you are living in the grit of metropolitan Mexico in 1971. The attention to detail, the background action and characters, the extreme realism transports you to another time. You can smell the smoke, dust; even the detergent that cleans the pots and dishes.The performances amongst the chaos of the house and town were masterfully elicited.Some believe this to be one the best films of the decade or some such, but the reality for me was that ROMA was more of a tea ceremony. Slow, observational and a mindful diversion; and sadly not a narrative arc that I bought and that affected me.As this is a heartfelt tribute to retell the days of director, Alfonso Charon's childhood in Mexico. The length of the memory strings that pull his heart are longer for him than they are for the viewer.The languid pace of the film though conjured up two stories I love: those of novelist John Irving in his contemplative and swirling stories of family and consequence (GARP, THE CIDER HOUSE RULES); and Coppola's ode to Tokyo, LOST IN TRANSLATION. The latter was spruiked by a timeless soundtrack which helped me absorb and appreciate the characters so much. While Cuaron uses some excellent in scene, prac. musical bites (eg YELLOW RIVER and 1970's overplayed MAMY BLUES), the lack of soundtrack extinguished the sense of unity and aural theme (save the concophounous background splatter).ROMA is however incredibly well made and purposeful. The realism is a spectacle. Though I do wonder why it was released in washed out monochrome. My daughter once asked me ""Dad, when you were a kid, could you see in colour too?"" Yep we all sure did and we also shot in colour didn't we.Like I said, I just don't quite know what to make of ROMA."
ROMA,27 February 2019,8/10,"Sometimes we forget that not only action and violence make good movies. It's a beautiful and a good story, not quite a good script, but you need to connect to the characters so you can feel what they're going through and if not, you miss the whole point of this story and you're only gonna see the perfect esthetic and photography."
ROMA,8 October 2020,10/10,"Roma is a nostalgic film that takes us to a time where architecture and science was the future. Written, directed, (Co)produced, edited, and shot by Alfonso Cuaron in the beautiful Mexico City. Described as a semi autobiographical project, Cuaron handles this project with experimental finesse that reminded me of Kubrick's opening shot of the Shining. The settings quietly tell a story as clear as the dialogue between the characters. Shot in black in white and running just a little bit over two hours, Roma captivates the audience with his usage of space and depth.The opening shot is that of a closeup of the driveway, then there's a slow constant rush of water. The location is still not fully disclosed to the viewer, all you can see is a reflection of the open sky. The shot gave me the feeling of being at the bottom of a well, trapped. Then a plane soars across the sky followed by more and more suds of soap. A beautiful shot of space and reflection. It is also at this time we are introduced to the main character Cleo (Yalitza Aparicio) and the family dog Borras.Cleo and Adela (Nancy Garcia) both live in maids who work for the family. Throughout the film there will be more and more social identifiers that show a separation from the family. I get the feeling there is a Jim Crow type of law in place or maybe a caste system. The family they work for aren't the only family who have live in maids. Cuaron does a beautiful and subtle way of depicting it's normality. After Paco (Carlos Peralta) leaves Pepe (Marco Graf) on the rooftop and Paco and Cleo are staring off into space. The viewer is staring off into the distance of other rooftops of other families who live just as they do.For some reason I find a strong sense of New York City and Tokyo when I look at little details. Sure every city has an alleyway but not every city is known for their rooftops. The art deco structures and designs seen in the movie are beautifully infused with rich Mexican history.The Family, is made up of the mother Sofia (Marina de Tavrina), Dr. Antonio (Fernando Grediaga), Sofia's mother Teresa (Veronica Garcia), the eldest son Tono (Diego Autrey), their middle son Paco, Sofi (Daniela Demesa), and of course little Pepe. Sofia and Dr. Antonio work, however what seems to be a constant strain, and lie, in their relationship is that Antonio has pending business in Quebec.Sofia is a chemist and she grew on me. Her hard exterior is due to her husband's absence and infidelites. There's one scene when Sofia comes downstairs and speaks with Cleo and Pepe before Antonio comes down. She mentions to Cleo he can be late, which I believed referred more to Dr. Antonio than Pepe. He comes down and says one word to Cleo and Sofia gives him the quickest and most disgusted look. It's subtle and fast, because Sofia is clearly not the person to overshare her personal strife with the help. However, by the end of the movie you realize she is a woman of great dignity and value. By leaving a situation she plays a sign of strength to Cleo.When Cleo tells Sofia of her pregnancy with Fermin's (Jorge Guerro) baby, there is a moment I with Cleo feared she would be thrown out. Sofia instead embraces her and even takes her to her doctor appointments. On the way to an appointment Sofia purposefully squeezes Dr. Antonio's car between two vehicles on the road. She waves it off as an honest mistake to the drivers whose cars have been hit, but how else would she get away with it. This car is also a vehicle in the sense as it's something important to Dr. Antonio.Dr. Antonio and his prized car are first introduced in what could be described as a music video from the audience's perspective, but as a wrestler's entrance to the character's in the story. He slowly drives in with his cigarette and oversized luxury car. At one point he stops and adjusts the car and continues down the now narrower alley. Once he parks he exits from the passengers side, an inconvenience that would annoy any person. Once again Cuaron has us examine the smoking doctor. He's clearly going through the stereotypical depictions of a midlife crisis.It is later revealed that along with the shiny new car, Dr. Antonio has a new girlfriend in the city. He is spotted by Tono and Cleo who keep the incident a secret. Dr. Antonio is seen briefly again at the end and when Sofia tells the children she's leaving him, I don't feel bad.The scene where Sofia tells the children she's divorcing Dr. Antonio is an amazing blend of emotion. The kids are sitting around eating ice cream and Sofia breaks the news. Paco takes it the hardest crying, but the rest of the kids take it well. Paco was the middle child until Pepe came around, but he is now the middle male child. It's a coming of age moment for one child and a new bedroom to the other.Though she is not a part of the family Cleo is there to witness it all; from their morning breakfast to Sofia destroying the car after a night of drinking.Cleo and Adela do have personal lives and some freedoms. They are allowed to visit to go to the theater, which is beautifully built and designed. In this era Cuaron also highlights that going to the movies was an experience just as grand as going to a play. Once inside the theater extravagant architecture is shown in the distance and a wide screen. This could possibly be another reason why this film is in black and white, using new forms of depth and space played in the background, movies today are oversaturated and gaudy displays. But we still like it.One person who is constantly present is Teresa, another great player in this ensemble cast. During her trip with Cleo and the driver Ignacio (Andy Cortes), they are beautifully overlayed by soldiers gearing up to take on protesters. Now Cuaron does not really use a digital overlay, as it's not what he wanted to clearly avoid in this project. He simply has the soldiers trucks and equipment shot upstage as the group walks downstage behind them. It's clear that the troops have no quarrel with the middle class, they're focus is on the students. Once inside the crib store it appears the sound of chaos outside is non-diegetic as everyone continues to shop. Suddenly a group burst in and shoot a man in front of the shoppers. The camera pans and we see Fermin pointing a gun at terrified Teresa and Cleo. Fermin and Cleo are frozen in this chaos as he is faced with a decision. Fortunately he decides to take flight and is off to live a dangerous life of violence. Once Fermin flees, Cleo's water breaks.For some strange reason the color of what is supposed to be the amniotic fluids reminded me of B Horror movie blood in black and white setting. I haven researched amniotic fluids but I thought they were clear and it looked like it might've been a pepto bismol pink or orange. Who cares it's in black and white? It's just something that stood out to me amongst my heartbreaking for Cleo. Fermin had already shown signs of possible domestic abuse and psycho-fanaticism.Cleo and the group now must dodge madness and get her to the hospital. A sad moment for Cleo that leaves us hopeful for her. Once at the hospital Cleo is taken to a room as Teresa assists the nurse with what little personal information she knows about her. Once in the examination room, Cleo is transferred to an emergency surgery room. The doctors begin performing surgery and they remove a quiet baby. It is later revealed that the baby is stillborn. Cuaron once again finds beauty in the madness as there is a shot of Cleo's sweating face and it appears the focus is on her breast and then in the distance we see her baby. Who would she be a mother to? Who would she nurse?This is later revealed when Cleo travels with the family in the final family ride in Dr. Antonio's abused prized possession. When Cleo turns her back to take care of one of the other children Paco and Sofi swim and get pulled out by a strong current. Cleo rushes back and reaches and grabs both of the children out of the waves. Once on dry land Sofia returns and Cleo confesses that didn't want the baby to be born. She begin crying and Sofia tells her they lover her, everyone joins in. They all cry together. Once we return the family and Cleo go back to their routines and we are left with almost a reversal of shots showing us that it is time for the viewer to leave. A feeling reminiscent of when Mr. Rogers Neighborhood is about to end. We are then left with the view of the exterior. I'm not sure if it's to allude to passing to another side but the ending is overtly positive. Everyone is ready for a new beginning.This is an excellent film and has elements that different crowds can identify with inside of the film and outside. At times it also feels the fourth wall is blurred and then just like Cleo we are pushed out of the fantasy and into another dream-like sequence, a very controlled dream. For example Professor Zovek plays someone with a cult like following. Perfect role for professional wrestler (Latin Lover) to play. Sofia and Cleo are both strong women who will persevere despite their situations. Finally there's Pepe, the dreamer in all of us and possibly Cuaron. With all the stories he tells, you hope he becomes a great storyteller."
ROMA,11 February 2019,7/10,"My family is from Mexico D.F. and from a middle class environment and many of my friends! They have lived in Mexico since the late 30's up to now and never have I witnessed that they care for a pregnant indigenous servant!!! On the contrary, the minute they discover they are pregnant, they are dismissed! I would enquire why and my answer was that Mexico had good Social Security hospitals and that the families couldn't put up with hiring these people with all the children they'd keep on having!!!"
ROMA,22 December 2018,4/10,"I understand why this movie is a work of art. I just don't know why it is a work of cinematic art. We are watching cinema, not video art.Underlying cinema is a story. The story has characters, that represent the complexity of the human condition - they have hopes, disappointments, successes and failures. They have different traits.Roma is a work of visual art. It has no story that captivates you. It has no characters that have any real sense of depth or complexity. If it's leading actress wins the Oscar it will be a shame. She was just a doll in Cuarón's autobiography.In a nutshell - it is boring.The leading movie critic in israel called it one of the most important movies of the century.I think the ""king has no clothes""."
ROMA,18 April 2019,8/10,"Simplicity is Art SublimeWhat comes across as striking about this movie is its unparalleled cinematography as well as direction. The real worth of art can probably be realized when it is stripped of its frills and façade. Roma is simplicity personified but that does not stop it from being profound and sophisticated. In a nutshell, Roma is a story of a house help who works for a middle class family with four kids Paco, Toño, Sofi and Pepe,their mother Sofia and father,Antonio,a doctor who falsely claims to go to Quebec for research,leaving behind his family in lurch. The family is at the verge of falling apart albeit Cleo and Sofia are able to eke out a life of their own.One would perhaps attempt to find traces of kitchen-sink realism in this masterpiece but that seems limited only to the trope.Devil is in the detailThe wispy trance-like state that clouds the commonplace for that matter even burnt and broken things is ethereal. For instance, the manner in which the broken jar that was raised as a toast to the new year and Cleo's baby or the man who sings against the backdrop of fire somehow symbolize peace, hope and aplomb even in the eye of storm. Who would have paid attention to minute details like cleaning up dog ordure or the rubbing and scrubbing of floor reinstituting the dignity of menial labour or even exalting it,painstakingly crafted, emanating a sublime aura. It revives many images from the past such as the scene outside the movie palace with balloon sellers crying their wares and the puppeteer's words ""no strings, no tricks"" quite poignant at this juncture as Cleo who has been forsaken by her lover almost resembling the puppet bone man.Reminiscing the turmoil ridden periodSet in 1970s Mexico city, the movie provides oblique glimpses into the period of civil strife and dirty war in the state which resonates at the domestic front too with the severing of relations between the husband and wife, also Cleo and Fermin who professes relentless loyalty towards martial arts but chooses to abandon her the moment he hears about her pregnancy. When all the male figures have fled, one witnesses the germ of new bond which momentarily transgresses the master servant relationship.Critics aver that Cleo hasn't been given much agency,perhaps, Alfonso Cuarón tried keeping Cleo's character closer to the reality,a persona who is gritty yet chooses to not to express much in front of her superiors adhering the norms. Nevertheless, her interactions with the younger lot is unrestrained,especially her tête-á-tête with Pepe.One of the remarkable scenes in the movie is when Cleo is doing laundry and Pepe and Toño are playing a make belief game. Pepe having been shot by his brother refuses to speak as he is dead figuratively.Cleo too becomes a part of this mystic make-belief and says that she likes lying like that possibly letting her inner feelings flow thereby acknowledging that she too likes taking a break. Superficially, it seems to be Cleo's portrait which it indubitably is,herein lies the craft of the maker Alfonso Cuarón whose portrayal of the character is completely contextualized that the line between the character and the context or the content and the form is obfuscated.Alfonso Cuarón's magnum opus is a cinematic legacy for posterity just like Ingmar Bergman's and Satyajit Ray's works, timeless and universal in appeal."
ROMA,9 January 2019,9/10,"I'm going to be honest and say I wasn't expecting a good movie. Yes the beginning is slow, but you start to get engaged and start enjoying what's happening, I'm from Mexico so it was like traveling in time to when those things used to happen. It's very good if you pay attention and stop thinking about how boring/slow the movie is. The emotion is there, the feelings of a mother losing a child she was scared to have, the acceptance, the grief. I would've liked another ending though. It was very good overall."
ROMA,5 February 2019,5/10,I want everyone to know that this movie is overrated
ROMA,23 February 2019,5/10,"I really tried to get into this movie, especially given all of the awards and accolades. But this film is too slow, the storyline is pretty dull, and I'm not a fan of black and white for no reason. I guess the cinematography is beautiful but that's not really why I watch a film. I'm afraid this is another example of Hollywood or movie makers being in love with themselves and their own work. This will probably win lots of Oscars and it will be another one of those movies where I don't understand why it wins. It reminds me of Moonlight which was a decent film but not worthy of Best Picture."
ROMA,2 March 2019,2/10,"I kindly recommend this to anyone who loves staring at nothing, through a still camera, for at least half of this film. Mister Alfonso Cuarón, the director, shows as things and people doing ordinary things without or with minimum dialog that will put you very fast to sleep. So, if you have trouble sleeping I also recommend this movie, is very efficient with no side effects."
ROMA,17 March 2019,9/10,"This film which won the Best Direction and Best Foreign Language film at Oscar was really good enough to win Best Picture. Probably being a Netflix film rather than a theatrical release, the Academy was somewhat bound to be biased against it.The director is in complete command of his cinematography, camera movements and frames. The movie achieves a perfect balance of realism and grandness. The story of women and families which they hold together in 1970s mexico is shown in a moving and hard hitting manner. The third act which begins with the 1971 student protests in Mexico and the massacre that ensued leads to an enthralling climax.A highly recommended film for all cinema lovers.My rating: 9/10"
ROMA,20 January 2019,9/10,"Roma can leave a long lasting impressionSet in the time of 1970-71 in Mexico, the movie has successfully portrayed a realistic picture of that era. Its a wonderful experience to watch this movie in black and white with the stunning cinematography. Although, there were hardly any turn or twist in the film, its realistic and linear storyline can leave a long lasting impression to the viewers . The movie is a semi-autobiographical take on the director Alfonso Cuaron's upbringing in Mexico City and he has successfully revived the details of the lifestyle of that time in the movie. Yalitza Aparicio, who played the role of an innocent maid 'Cleo' and Marina de Tavira, who played the role of the wife of a doctor were the main characters of the film and they successfully portrayed their characters. Last but not the least, the cinematographer cum director Alfonso Cuarón did a spectacular job with the long panning shots which were worth watching. Overall, you should watch the movie if you are a cinephile."
ROMA,11 February 2019,1/10,I kept waiting for something...anything to happen. But it never did. My mundane life is 10 times more interesting then the most exciting parts of this movie. Just last Sunday a plane missed crashing into my house by about 300 yards. The destruction I saw was far more dramatic then this bore of a movie. Dont waste the 2 hours this movie wants to steal from you!!!
