Title,Date,Rating,Comments
ROMA,10 May 2019,5/10,"I appreciate Cuaron's past art. He is one of the best directors today. The cinematography by Cuaron is the only greatness in this film. Other than that the movie is a bore and overhyped. I'm happy he was able to reproduce nostalgia on film but what a hum drum remembrance. Poor Cleo has to scoop up dog doo. Big deal. I've done that my entire life after walking my dogs. It certainly isn't worthy of film. I get it. The boyfriend leaves, the father leaves, the turmoil. It's just expressed in such an uneventful and unimaginative way. If you want a slice of life in the 70's, with some actual life to it, investigate "" City of God"". Whether the movie is so very accurate and brings back fond memories to so many as far as life in Mexico City during the 70's , the bottom line is this isn't Cuaron's masterpiece. It's his lame duck."
ROMA,11 December 2018,10/10,This film is an emotional roller-coaster. It is beautifully shot and directed by Alfonso Cuaron. It is about a family in Mexico in the 1970's. They have a nanny named Cleo who is at the heart of the film.We see the family has love for Cleo but it at first always a servant. The opening shot of the film is so beautifully crafted you wonder how the filmmaker did it. You at that moment i think know your in for something special. The sound and music in this film so moving and evokes a real feeling inside you. The black and white photography is done so well and it times you forget your watching a film in another language. I dont want to say too much more about this because I dont want to give to much away. But do yourself a favor and watch this on the biggest screen you can find and not on a computer screen. You owe it to yourself. This film reminded me why I really love movies and went to film school and studied film.To go and see something different from what you have seen before. To get a slice of life from a family you wouldn't otherwise ever see in every day life. This is one of the best films of the year if not the best. I still of others to see. This film deserves serious Oscar consideration. I highly recommend this film.. .
ROMA,25 February 2019,4/10,"Well I knew from the start this movie would be painstakingly slow but it wasn't as boring as I expected. With that being said there was absolutely no excitement. The videography is also very overrated the black and white color scheme along with the era it's portraying (The 70's) tricks your perception into thinking it's more artistic than it really is because the camera is topnotch and very clear and by utilizing computerized wide angle panning it keeps everything clean and crisp adding to the realism of the film. Yes this flick was too long but do I feel like I wasted 132 minutes of my life, not necessarily. Do I think this film was worthy of winning an academy award, not by a mile. Whoever's rating these films needs a complete overhaul. These old institutions controlled by these pompous hypocrites with poor taste has become obsolete and doesn't hold the weight and or garner the respect of winning an award like they use too."
ROMA,12 January 2019,6/10,"I don't understand the discussions about the film. The film is well counted. it describes social problems very well. The maid is very hardworking but
they still chastise him. Woman i's rich, but still dependent on her husband. there are political conflicts and murders. There's a hopeful finale. There are lots of similar good movies."
ROMA,4 December 2018,10/10,"With this title I'm not trying to sound utterly overwhelmed, but to acknowledge the fact that I feel unable to describe with simple words this film.Let's start by saying that it is indeed one of Cuarón's best works (though I still consider Children of Men as my personal favourite), also probably the best film of 2018 (I couldn't see The Favourite yet, the other film of the year that I believe has serious chances of winning the title). It is a very slow film, has a pacing that reminds me of Tarkovskij films. It is not very introspective scope: the viewer mostly might feel physically distant (also due to the frequently wide-angled photography), but yet can be emotionally connected to the characters and the story.There's a very abudant apparatus of subtext: much is implied, and this is particularly true with Cleo's thoughts. Another element that suggests that much is implied is the presence of flying airplanes, that occurs in specific scenes, suggesting a meaning to it.
Mind, unlike Nemes' Sunset, this film isn't an allegorical story but a realist story. Frankly, it reminded much of Inarritu's first films (21 Grams, Biutiful, etc.) due to the realist factor.This film sets an interesting directoon to netflix films: easily said, it is the best Netflix original. It is also an arthouse film, and very clearly so. This film could start a new tendency (especially if awarded at the Oscars) for arthouse films to be produced and released by netflix, a company known for providing creative freedom to directors. In the past years, this had mostly a negative impact, with several 'bad' netflix originals, but this allows genial filmmakers (like Cuarón, but potentially others aswell) to create their works without boundaries. Let's hope this tendency continues."
ROMA,24 January 2019,7/10,"The oscars reflect hollywood persona more than exemplify peer review of film making. Maybe it's always been like that I don't know but this year is no exception because 10 nominations for this kind of film is unjustified. IMHO Mr Cuaron produces the most complicated scenes on film of any director I can think of, past or present. But his films don't have a level of story telling that I would expect from his professional tier. Even 'gravity', which is his most commercially successful movie to date doesn't have much story to it and 'roma' has even less of a plot. This movie is wonderful to watch from a technical perspective. The scenes are long with no cuts. The scenes have very complicated cinematography. They have a lot of actors and extras that are perfectly choreographed. But, this movie has very little story to it. If you took away all the complicated cinematograpy and staging, it would be colossally boring. And it's not because I can't relate culturally to the characters or settings in the movie because one of my favorite films (series) last year was 'my brilliant friend', an italian tv series hosted by HBO. I have nothing in common with this production either. I'm not italian. I didn't grow up in italy in the 50s. There are parts which are incomprehensible from my cultural perspective but it's nonetheless a beautifully told story. Two completely different non-english film productions that are amazing to watch but one is a very simple production but very full story told wonderfully and one is a complicated production with almost no story to it. If 'roma' is worth 10 oscars, where are the accolades for making 'my brilliant friend'? BTW, if you haven't seen 'roma', it has nothing to do with italy and it has nothing in common, storywise, with 'my brilliant friend'. I only mentioned 'my brilliant friend' because it's a wonderful non-english film (series) that hollywood would never make and with respect to productions, the two films have a lot in common."
ROMA,18 January 2019,9/10,"The only other Alfonso Cuaron film I've seen was Gravity (2013) which I thought was absolutely stunning, but in quite a different way than Roma, which is almost its polar opposite in subject matter and style. If there's any common factor, I'd put it down to simplicity and vision. Everyday life in and around Mexico city in the 1970's lives and breathes in Roma, portrayed in a very methodical, unhurried way, but the whole thing has a kind of cumulative power that is rather hard to define. It's all in the way it's done.Cleo (played by Yalitza Aparicio) is at the heart and soul of this story, as one of two domestic workers (the second one is the cook) in the household of an upper-class family with 4 young-ish children. The parents, and others in their upper social class, basically do what they like and it's left to their hired staff to pick up all the pieces at home to keep things running. In Cleo's family the parents are out at their work much of the day and it seems to be expected of Cleo to do just about everything around the house: constantly look after the children, fetch and carry, laundry by hand, errands --- she's on her feet all day long. But far from being a 'slave' she's a loving and loved member of the household: she and the children have strong bonds. Apparently, Roma is an homage to Cuaron's own childhood nanny, so it's a very personal accomplishment.Everything about this - the settings, the street life, the household, the close ties between Cleo and the kids -- is all utterly realistic. My wife and I both travelled a fair bit to Chile (Santiago, Concepcion, La Serena) for work purposes in the 1970's and 80's and it all looked and felt like that. Any well-to-do household had someone like Cleo working for them: the family would typically be of white/hispanic stock and the hired workers were aboriginal, sometimes (like Cleo in this story) from small hardscrabble villages. Life in the town happened on the street, not inside the houses. The streets are always filled with people going every which way in and out of small shops, chatting, and ducking fast-moving ramshackle old cars. There are always dogs roaming free -- lots of dogs. Random marching bands playing badly go by on the street for no apparent reason. Soccer fields where young men gather are just dirt and dust. ""Roma"" sets up this ambience without making any particular point about it -- it's just there.None of this background gets across the peculiar effect of Cuaron's direction. The strength of human love and community devotion shine through here, but also the resilience, love, and self-reliance of average people. We see everything from Cleo's point of view -- not just her family but also occasional major events ""out there"" that just happen around them and that she simply witnesses: an earthquake in the city, a brush fire, a student demonstration and subsequent deadly riot. None of these necessarily fit into any coherent plotline, but I take it as just Cuaron's building of a comprehensive picture of life then and there.Through most of the film there's also no musical score, which was a clever choice that I thought drew us in closer to the characters. Like other viewers I was really struck by Cuaron's camera technique here. Often it simply sits steady as a rock while the scene develops. Equally often it pans, very slowly and very steadily, to give a broader perspective. The culmination of all this comes at the end, when Cleo, the mother, and the kids are all at the beach for a picnic. Cleo, who can't swim, ultimately has to wade very far out into the gathering surf to try to pull back two of the kids who've gone too far. The camera simply follows her slowly out, farther and farther into higher and higher waves, with absolutely nothing else on the screen to look at. Without giving away how it ends, I'll just say that the simplicity and raw power of this scene make it, somehow, one of the most remarkable I've ever seen in a movie. Any director who could envisage this and pull it off has my admiration. That scene is worth the whole price of admission, but you need to see everything that comes before it to get its full meaning."
ROMA,5 February 2019,5/10,"I have to praise all the technicians aspects of the movie, mainly your direction, off course, is amazing staying the camera stopped and see the characters in motion, the photography is beauty, see this in black and white didn't me bother, but I have to admitted that the plot is not great, is so simple, and in the end your understand that is a just simple story filmed in the wonderful way."
ROMA,10 February 2019,6/10,"This usually doesn't happen but by the time Roma ended, I wasn't sure how to rate this. I thought I was bored, yet I was completely captivated it; working as a slow burn. Many have said it is amazing from a female point of view and not that, that is a bad thing but as a male I can't relate on the same level as a woman would watching Roma. However I did sympathize with the main character... see what I mean? This movie left me so lost for this review. I absolutely despised Fermin which is an incredible feet for a character who only appears in probably 15 minutes of an over two hour film. There is so much symbolism in this movie, that maybe I do need a second viewing to really like it, but for now I'm going to give it a 7 because it did keep me captivated and the cinematography was gorgeous. I'll probably update this if I watch it again."
ROMA,26 November 2018,7/10,"Alfonso Cuaron depicts the life of a young housekeeper in a prosperous family household in Mexico in the early 1970s in this heartfelt, slice-of-life drama. He does so with a stellar cast, black-and-white filming and crisp cinematography that includes wide ranging geography within Mexico.I was impressed by how well this film held my attention from start to finish. It isn't always the smoothest narrative and there are occasional lulls in the storytelling but it slowly lifts you into a state of wonder. Some scenes are quiet and deliberate. Others are Fellini-esque. The film covers a surprisingly broad landscape as we watch this woman seek out the young man she believes is her destiny as well as cope with the goings-on of the family she must tend to where not all is well. There is also a sense of the strong social unrest in Mexico during that era.Cuaron has made a deeply personal film, one that harkens back to the Mexico in which he grew up. It is seen through the eyes of a young woman with a modest job. The black and white filming actually makes you forget that this took place in decades past. Instead, it feels very contemporary. There are some profoundly poignant moments here even if the pacing is a bit inconsistent. At times, you'll be holding on for dear life. At the center is a quiet, reserved but very genuine performance and one that lights up the screen. Gladly recommended."
ROMA,8 February 2019,8/10,"Beautiful film by Alfonso Cuaron. Clearly cutting the lines in the sand of 1970's Mexico City. We follow the very kind Cleo, a house help in an upper middle class family being torn apart by infidelity.My wife and I discussed this movie and agreed on it being quite slow but still intriguing. This is so as our lead actress gives us an Oscar worthy performance with her conveying of emotion, and director Alfonso Cuarón does an excellent job at depicting 1970s Mexico City. In my opinion there are three very strong and emotional scenes in the film only captivating me more so.Cinematography is absolutely beautiful in black and white monochrome. There are several instances and even scenes consisting of one shots reminiscent of the cinematographic style of Alejandro Innaritu.Overall a recommendable and beautifully constructed film."
ROMA,16 December 2018,10/10,"Alfonso Cuarón has made several brilliant films, but he has truly outdone himself and made his true masterpiece with this searing, thoughtful drama set in Mexico City in the early 1970s. ""Roma"" is absolutely stunning, and the best film of the year. The film is an ode to Cuarón's childhood and what he perceives to be a Mexico of a somewhat distant past. It is a drama that primarily surrounds Cleo, a maid, and the family of the house she cleans, yet the film's depth is so much more than a simple one-sentence synopsis could provide. Once you see this film, you will not be able to forget it.Cuarón clearly intended the tone of ""Roma"" to be deeply rooted in realism, which is evident by the film's extraordinary black-and-white cinematography. The film is a technical marvel, with cinematography that helps each frame stand out. While the film does not really have a score, viewers won't miss it, as Cuarón's sound design is expertly constructed to an almost intoxicating degree. Even though I love many of the scores of films I really admire, this movie makes you appreciate just how much emotional power is delivered through the characters, cinematography and sound design that the absence of a score actually enhances the film in many parts. The film's third act is extremely powerful and a true roller coaster of intense emotions, yet each and every emotion Cuarón brings to the frame is truly genuine. Every sight and sound in the film has a purpose in tandem with the narrative, making the film's plot structure seem meticulous. The film's realism is present in its inherent motifs as well. For example, while the film certainly provides commentary on the deep-seated inequality present in Mexican society, its worldview is also pluralistic and universal in that lines of unity rather than division between characters are often emphasized. I particularly took note of this during the scenes with both Cleo and Sofia (the household matriarch,) many of which are incredibly poignant. The movie also pulls off an incredible feat of depicting social and political unrest around this time in Mexico City in considerable detail, without ever feeling overtly political or preachy as a film as a whole. (The story is didactic, but never preachy or melodramatic.) The film is lighter on dialogue than many dramas, but this is certainly not detrimental to the story given that the screenplay does a brilliant job communicating as much as possible in as few lines of dialogue as possible--which is, of course, what master screenwriters always strive to do.As a family drama, a slice-of-life film, an ode to Mexican society and culture, and an epic, ""Roma"" succeeds with flying colors. 10/10"
ROMA,22 November 2019,8/10,"This movie is as boring as it could get.
forget there will be blood forget no country for old man if you can get through this movie you are great man and just like I other two movies I mentioned it was good movie"
ROMA,5 September 2019,9/10,"Alfonso Cuarón created a totally unique, poetic cinema experience inspired by his own upper middle class childhood in the Colonia Roma neighborhood of Mexico City in the 1970's. The POV is centered on the Indigenous woman who was his family's beloved live-in domestic housekeeper and nanny to four children; she was the quiet backbone to the family during a year in which their father, Antonio, left their mother, Sofía, (as they were so-named in the film).Alfonso auditioned actresses for a year before finding Yalitza Aparicio who - in her first ever acting role - inhabits the role of Cleo with a humble naturalness that allows the audience to be swept into a yearlong slice of her life as a young woman during personal and political upheaval.From the opening moments when we are drawn into a black and white shot of soapy water being repeatedly slopped and rinsed over floor, the audience is asked to let go of the mind, be patient, be present, and surrender to this ride.Their world is centered in a home of structually open design with a beautifully-railed staircase that Cleo trots up and down spritely and alternatively laboriously on in her daily service to the family, on a street on the more run-down side of town. A rambunctious dog oversees everyone's comings and goings to punctuate the jumpy upheaveal in their lives. The garage is either too narrow or the boat-of-a-car too wide, and each time the vehicle is manuevered, (carefully or not), into the confined space, I could practicaly smell the smothering exhaust as the conflict of desiring more than is possible or appropriate, and the resistance to seeing another way, knocked against me as the car was dented by contact with the claustrophobic walls.Quiet moments are interspersed with both lively and chaotic noisy city ambiance. Wide yet nuanced shots in black and white capture intimate details of Cleo's life caught in the throes of classism, racism, sexism, and a crude, patriarchal society. Her boyfriend for a brief time, Fermín, turns out to be a no-good gang member who physically and emotionally abandons her in her time of need. An emergency visit to a hospital is brilliantly shot to detail the impersonal and cruel reality Cleo experiences.As Cleo is mourning a devestating loss that she is wracked with guilt over, Sofía invites her maid to join her and the children on a trip to the sea. Cleo's relationship with, and love for, her charges and the instinctual sacrifice she makes without question for them made this film memorable for me; although the journey was wrenching at times, I found it a rewarding one that leaves me with lingering images to savor and grieve.To put it mildly, this film is a marvelous work of art."
ROMA,22 December 2018,9/10,"There are not many films out there that can, slowly but surely, invoke the feelings that Roma does within you.
The acting is all around great, and the directing by Alfonso Cuaron is just on another level here. Every scene is so well detailed and so captivating, from the sound to the dialogue. It all just feels so real, and that is the word I would use to describe this film, real.
However, going into this film I must admit that I was expecting it to be perfect, and it is still very great, but I did not get that finishing touch I was expecting, and that may very well be my own fault, but in re-watch I might love it more than I did the first time due to false expectations.
This is definitely one of the better films to come out this year. an emotional gut-punch all throughout, with important lessons to be learned, and incredible film-making to behold."
ROMA,24 December 2018,6/10,"Do not get trapped by the hypes and fanfare, it is a black and white movie focusing on the scenery where events take place, all resources were invested in the graphic messaging to convey climate. The story goes about the domestic life of an upper middle class family in the Mexico of the 70 s, in the foreground the personal life of the help. Ending not in line with movie, left me frozen and dissapointed"
ROMA,16 December 2018,9/10,"Begin rant: Netflix to me is the bane of the art of filmmaking. It's where art goes to die. Watching Roma on a computer screen, where most will eventually watch it, is a crime. In part because Netflix encourages such poor viewing habits, and laziness: people will invariably pause, stop, or half-watch this film in a fragmented manner, often with with lights on in their room, or other screens, and they will miss the details which make Roma so sumptuous. Most will hear this film through their laptop speakers, missing the lush, enveloping sound design, while they peruse Amazon on a competing browser tab. Many will no doubt fail to make it to the end, finding it 'too slow' or wonder why it is in black and white.This is the main difference between the cinema and Netflix: Netflix you can control. The cinema on the other hand controls you; you pay, you sit and you are subjected to a film, and be damned if there's anything else you want to do. You're stuck there and you're going to experience it full on.The bitter irony is that Netflix is also one of the few places filmmakers of great artistic import have left to fund their personal projects, or anything that doesn't involve 200$ million plus in CGI or superhero makeup. Netflix, having sucked the entire market into its gravity, has the megabucks and as a result is willing to take the risks that studios won't anymore. And that reality, for a cineaste, is a tremendous sadness.But that is where we are. And what we still have are artists like Cuaron who have a vision and will find a way to deploy that vision no matter what it takes. The result is breathtaking. And, whether Netflix likes this or not, we have the viewers who bought up every single ticket of this film at my local theater (it played in a single small theater in Montreal) in a matter of hours, knowing that they will only have a week to watch it before Netflix yanks it and makes it exclusively available on their platform. I hope somebody at that company notices.Roma is an intimate, personal film told simply, with the utmost attention to detail, and it contains a great deal of humanity, empathy and beautiful imagery that is completely worth your money. If you get a chance to see it in a theater- do it. That is all you need to know."
ROMA,1 April 2020,8/10,"A wonderful movie. Slow-moving, yes, but well worth slowing down for. In the end I found the genuine emotional connection that was made across barriers of class completely believableï¿ 1/2""and that is really saying something."
