Title,Date,Rating,Comments
ROMA,2 January 2019,10/10,"Have a lot of admiration for Alfonso Cuaron as a director. Also really like to love almost all of his films (having been mixed on 'Great Expectations'), though 'Gravity' is one of those more appreciate than love divisive films that also boasted some of the best cinematography and direction of that year. Of his previous films am especially fond of 'Children of Men' and 'A Little Princess' (the film that introduced me to his work and is a personal favourite) in their own way for different reasons.Was really excited in seeing 'Roma', with talks of it being one of the highlights of 2018, one of Cuaron's best films and trusted friends saying how emotional it was and especially praising the cinematography, direction and sound mixing. Nothing was going to stop me from seeing 'Roma' with the praise being as high as that, despite the (from personal opinion) rather condescending detractors being quite vocal, including making ignorant and off-base paid reviews allegations that says more about themselves than it says those they're criticising. After seeing 'Roma', and this is a genuine opinion here, am going to join those praising the film. Praise that 'Roma' deserves every ounce of and more. One of my favourite films of 2018 definitely, and it has been a variable year so that is saying quite a bit, and quite possibly Cuaron's best film.'Roma', being a semi-autobiographical film, is Cuaron at his most personal, both the writing and the direction. One of the main reasons why 'Roma' did such a lot for me was the emotion, with such brutal thought-provoking realism and poignant, without being over-sentimental, pathos it was the film that connected with me the most emotionally. It also was him at his most thought-provoking and there was no sugar-coating, in fact what was also admirable was the not holding anything back pulls no punches approach. It depicted real life situations and struggles and in a way that was relatable and hard not to get nostalgic or moved over.The pacing has been criticised for being slow, it is deliberate but personally was caught up in the emotion and the compelling realism of the very personal story-telling to care. Plus since when has a film being slow ever always being a bad thing? It only is a problem when there's no reason to be and with the subject to me it came over that the deliberate pace for 'Roma' was not an accidental choice. Sure, finding its rhythm is not immediate but it is very rewarding when stuck with (rather than stopping watching after a ridiculously short period of time and then bragging about doing it). The script is sincere and thoughtful, not written or delivered heavy-handedly.Now we get onto what is especially great about 'Roma'. It is a visually stunning film, have not seen cinematography this amazing, varied or clever in a long time and it complements the evocative setting and the strikingly effortless and atmospheric lighting so brilliantly one is truly immersed. Another major star is Cuaron's direction, showing a visual master of his craft and a person clearly passionate and in love with the story he's telling. Both wholly deserving of major awards attention. Same with the sound-mixing which has all three of the qualities that the cinematography has been described has, so appropriate to the mood and enhances it in a way that few other films this year have done so well. As well as the astonishing and very moving breakthrough lead performance from Yalitza Aparicio, as the most compellingly real and rootable character in a film full of them and strong performances.In conclusion, absolutely loved it. 10/10 Bethany Cox"
ROMA,27 February 2019,5/10,"ROMA is a 'snapshot of life' style movie from director Alfonso Cuaron, one which has received plenty of acclaim recently as well as the award for best foreign language film at the Oscars. Still, what do they know? For me, ROMA is a typical kind of movie, not particularly powerful or hard-hitting, and flawed to say the least. Cuaron has done much better with the likes of CHILDREN OF MEN and even HARRY POTTER AND THE PRISONER OF AZKABAN. The film follows an ordinary poor family and their nanny as they go through a period of social upheaval in Mexico in the 1960s and 1970s. Naturalistic performances from an unknown cast count towards it, but the story is episodic and stretched out and the decision to shoot in black and white robs it of vitality. It's better than GRAVITY, but that's not saying much."
ROMA,7 June 2019,7/10,"Cleo Gutiérrez is one of two maids working for an affluent family in Mexico City. There is marital difficulties as the husband Antonio leaves for Quebec City. Cleo's boyfriend disappears after she tells him about her pregnancy.The black and white cinematography is terrific. The movie starts looking good but horribly slow. It's the slowest of art house movies. It borders on pretentious. Then Cleo starts to have more to do than simply mop the floor. It's interesting to have a non-actor be the lead but it's also limiting. The movie builds up its story until an epic street battle. I like almost everything about that sequence except holding the last scene on that couple in the streets. The power of seeing the horror indirectly is completely obliterated by pointing the camera at the specific aftermath. There is also the drowning scene. It's too obvious. Again, filmmaker Alfonso Cuarón is pushing the point too hard. It's in your face and he can do better. There is also something awkward about being that obvious when the shooting style is so observational. They are minor bumps in an otherwise compelling ride."
ROMA,16 March 2019,10/10,"This broad, award winning film, brings a culture that few of us are aware of, down to the basics. There are dream and hope. There is a subtlety here that has been put there by a filmmaker that sees all sides and lets the audience grapple with the issues. There is beauty and pain, but it is melded masterfully."
ROMA,23 January 2019,5/10,"Roma is a personal film from Alfonso Cuaron. It certainly seems to hark back to his childhood as it is set in Mexico of 1970.Shot in black and white, the way the shots were composed certainly reminded me of European cinemas of the 1950s and 1960s. It could had been made by Fellini or Clouzot.It tells the story of two women across the class divide. Cleo is a young maid working for a middle class family. She is treated well and she has a boyfriend, Fermin who loves his martial arts. When Cleo falls pregnant Firmin abandons her. When Cleo sees Firmin again in the backdrop of violence, the shock pushes her to labour.Sofía a biochemist who teaches and Antonio, a doctor are Cleo's employers. They have four children as well as Sofía's mother living with them.However the household is going to split. Antonio goes for long business trips, it signifies that he has a mistress and this time he has no plans to return.Both Cleo and Sofía are abandoned by their men.Roma is beautiful to look at. Cuaron also makes a reference to his award winning Gravity by a showing a scene from the 1969 film, Marooned.However there is very little story here, it does feel flat and insipid. We know very little about the characters and the events depicted. It is like a slice of Maria's life. It left me unfulfilled."
ROMA,22 February 2019,6/10,"The boring daily life of a maid in the 70´s in Mexico is the storyline of ""Roma"". The screenplay follows the life of Cleo, the maid of an upper middle-class family. This is a typical film for professional critics and viewers from the First World. For a Third World viewer, the situations shown in ""Roma"" happen everywhere and every time and are part of the dailylife. The beautiful black-and-white cinematography and the excellent camerawork are the great parts of this average and overrated film. My vote is six.Title (Brazil): ""Roma"""
ROMA,7 February 2021,5/10,"A colleague of mine, who's an art student brought in the dvd and insisted I would love it.If I'm honest, I couldn't follow it, there's a story here, but I think I'd need to watch it again to fully understand what was going on, but for me, the pacing was so slow, I really couldn't sit through it again.On the plus side, it's beautiful, I'm an amateur film lover, and in no real position to comment, but the filming, camera work, and direction are jaw dropping, if you're into art house, you will have a real appreciation for this.It's not my cup of tea, for me it's style over substance, but I can see why there would be an appeal. 5/10."
ROMA,3 July 2019,8/10,"Life of a maid - I never had a maid or nanny. But we all know about women (mostly) who do this type of work. It can be because the parents are too busy (work related mostly) or because they just want more free time for themselves. Now if you attach an attribute to that, you are the one judging, I'm simply stating what most of us know anyway.Try to be open minded, although even if you aren't the movie slowly takes over. It's quite slowly paced, but that is how it gets to you. It's mundane and it feels like you are invading someone elses privacy. But instead you just get to be another member of the family/group. Someone who is just there to observe. And while you may know where this is heading, the planting/seeding and later harvesting of clues and happenings (car parking for example) is quite something. To say it is well made, would be an understatement, but it also is able to touch you. If you let it that is of course. Good movie/drama"
ROMA,29 December 2018,7/10,"I've found Netflix original movies to be a hit or miss affair, mostly miss. This one comes somewhere in between. As I write this, ""Roma"" is getting all kinds of Golden Globe and Oscar buzz, but I have to wonder if that has more to do with the current state of pop culture and #MeToo sensationalism as opposed to the story it tells. Because the story itself is somewhat rather mundane, a slice of life look at a Mexican housemaid and her employer who are the principal characters. Both are beset by troubles inflicted by their partners, the homeowner Sofia (Marina de Tavira), who's husband has left her, and Cleo (Yalitza Aparicio), the domestic who's almost part of the family but always knows her place in it's hierarchy.To be fair, there are some uniquely creative elements in the story that drew my attention, like the Mexican family's penchant for having the heads of their deceased dogs mounted and hung on a wall, and a guy made up to look like Swamp Thing in a couple of scenes. The one with the naked martial artist Fermin (Jorge Antonio Guerrero) seemed to be thrown into the story for it's voyeuristic possibilities; it didn't take much from there to determine that Cleo's choice of boyfriend would turn into a creep who would cause her much suffering.There was really only one time in the movie when something of a momentous nature occurred, and that was during the first twenty minutes of the last half hour of the story. The beach scene had this viewer on tenterhooks trying to determine what the outcome would be with the two young children who ventured too far out into the ocean. At that point, the film could have gone for unrelenting pathos or a miraculous save that would put Cleo's life in context of a bigger picture than the day to day conditions she had to endure. The story opted for a life affirming message that allowed Cleo to transcend her mundane existence, and that was a good feeling.I wouldn't go so far to say that this was a bad picture or that I wouldn't recommend it, but it does require a certain amount of patience to sit through. It's held together by some humorous spots that worked when required, my favorite one was when Fermin's friend Ramon (José Manuel Guerrero Mendoza) reluctantly agreed to bring Cleo to where her boyfriend was training. Realizing he was going out in public, he stated, ""Hold on, let me put on some pants""."
ROMA,8 January 2019,10/10,"Alfonso Cuarón's ""Roma"" is about a maid working for a middle class family in Mexico City in 1970-71, but overall focuses on a couple of things. The obvious point is Mexico's social hierarchy. The protagonist is Mixtec, while her employers are white. One scene pans across the rooftops, showing the maids hanging people's clothes. Equally important is the political situation in Mexico at the time. Industrialization in the 1950s and 1960s had driven millions of rural people into the capital, where they had to live in slums. The years of Cuarón's childhood were marked by the army's massacre of protesters in Tlatelolco right before the Olympics started, and then by the Corpus Christi Massacre (which the movie depicts). The depiction of the father abandoning the family brings to mind Cuarón's expose of Mexico's ruling class in ""Y Tu Mamá También"" (which also showed the country's hierarchy).On top of this, the city itself is just as much a character as any of the cast members. The locales - whether the upscale neighborhood where the family lives, or the slum from whence the maid comes - and the various sounds mark almost every scene in the movie. Indeed, much of the movie is minimalist, emphasizing the action. It all adds up to another fine piece of work from one of Mexico's three great directors of the past thirty years. I recommend it."
ROMA,24 February 2019,8/10,"Along with The Favourite, this was the most nominated movie at the Academy Awards, both films receiving ten nominations, it was predicted to do the best during Awards Season, and it was available to watch on Netflix, so there was no way I could miss this Mexican film, from Oscar, BAFTA and Golden Globe winning director Alfonso Cuarón (A Little Princess, Harry Potter and the Prisoner of Azkaban, Children of Men, Gravity). Cleodegaria ""Cleo"" Gutiérrez (Oscar nominated Yalitza Aparicio) is an indigenous live-in maid in a middle-class household in the Colonia Roma neighborhood of Mexico City. Living in the house with her are the family: matriarch Sofía (Oscar nominated Marina de Tavira), her husband Antonio (Fernando Grediaga), grandmother Teresa (Verónica García), their four young children, and Adela (Nancy García García), another maid. Antonio is a doctor, he leaves for a conference in Quebec, it becomes clear that Sofía and Antonio's marriage is strained. Antonio returns briefly, but leaves again, saying he is going to Quebec for a few weeks. Cleo and Adela go out to the cinema with their boyfriends, Fermín (Jorge Antonio Guerrero) and Ramón (José Manuel Guerrero Mendoza), but Cleo and Fermín decide to rent a room instead. Later, at the cinema, Cleo tells Fermín that she thinks she is pregnant, as the film are seeing is about to end, he leaves saying he needs the bathroom. But he does not return and is nowhere to be found, Sofia shares her concern, and takes her to the hospital where Antonio works, a doctor confirms her pregnancy. Sofía takes Cleo, Adela, and her children to a family friend's place for the New Year holiday. Landowners and the workers mention recent tensions over land in the area, and during the celebrations, a fire erupts in the forest. Everyone helps extinguish it while a man counts down the remaining seconds of 1970 before singing a Norwegian lullaby. Back in the city, Cleo accompanies the children and their grandmother to the cinema to watch a movie. They see Antonio walking out with a young woman, Sofía tries to conceal this from the children, but her second son eavesdrops and learns about it, she tells him not to reveal it his siblings. Through Adela's boyfriend, Cleo finds Fermín at an outdoor martial-arts class, she also attends. Fermín refuses to acknowledge that the baby is his and threatens to beat Cleo and the unborn child if they try to find him again. With the baby almost due, Teresa takes Cleo to buy a crib. On the way, students are gathering to protest, this turns deadly when police commence clubbing, while bands of roving youths randomly shoot at protesters. When a wounded man and a woman run into the store trying to hide, several youths find the man and shoot him dead, another gunman, who points a gun at Cleo, turns out to be Fermín; he glares at her momentarily before running off. Cleo's water breaks, she, Teresa, and their driver try to get to the hospital but are stuck in traffic amid the violent protests. Antonio comes by to reassure Cleo before she reaches the delivery room but makes an excuse to avoid staying. Hearing no heartbeat in Cleo's womb, the doctors take her into surgery, where they deliver a stillborn girl, there are multiple failed attempts to resuscitate the baby. Sofía has a drunken failed attempt to park the family car in the car garage, she buys a narrower car, but plans to take the family on a final trip in the old car to the beaches at Tuxpan. Cleo is brought along as well, Sofía wants to help her cope with her loss. Sofía tells the children that she and their father are separated, and that the holiday was so their father can collect his belongings from their home. At the beach, two of the children are almost carried off by a strong current, despite not knowing how to swim, Cleo wades in to save them. As Sofía and the children affirm their love for Cleo for such selfless devotion, she breaks down and reveals that she had not wanted her baby to be born, they all hug her on the sand. They return home to Roma to find the house reorganised. Cleo prepares a load of washing, telling Adela they have a lot to talk about. Cleo climbs ladders to the rooftop with the clothes to wash before the credits roll. Also starring Diego Cortina Autrey as Toño, Carlos Peralta as Paco, Marco Graf as Pepe, Daniela Demesa as Sofi and Latin Lover as Profesor Zovek. This is definitely an art-house approach to filmmaking from Cuarón, telling a poignant semi-autobiographical story in black-and-white colour, it is a compelling of a marriage falling apart and a live-in maid standing at the heart of the family, the 1970s setting all looks and feels authentic, the camerawork with slow tracking, widescreen shots and striking lighting is effortless but effective, it is a simple, fairly quiet, but most enthralling drama. It won the Oscar for Best Foreign Language Film of the Year and Best Cinematography, and it was nominated for Best Motion Picture of the Year, Best Original Screenplay for Alfonso Cuarón, Best Production Design, Best Sound Editing and Best Sound Mixing, it won the BAFTA for Best Film, Best Film Not in the English Language and Best Cinematography, and it was nominated for Best Original Screenplay, Best Editing and Best Production Design, and it won the Golden Globe for Best Motion Picture - Foreign Language, and it was nominated for Best Screenplay. Very good!"
ROMA,21 December 2018,,"This film has beautiful and thoughtful visuals constantly. The background is very well composed, and there are many times when the background is more interesting than the foreground. The number of extras they have to hire for the background is almost unbelievable!As for the story, it is very very slow in the first half. I was thoroughly bored until the plot finally starts to pick up in the hospital. The intense final half an hour saves the film for me."
ROMA,26 December 2020,7/10,"I have to say that I found the look of this film quite breathtaking - Cuarón's beautifully shot depiction of life in Mexico City in the early 70's is positively laced - almost like a collage of photographs - with stylish imagery. The fact that it is entirely shot in black and white adds richness too. Though set in pretty turbulent times, the story, however is really nothing to write home about. ""Cleo"" (Yalitza Aparicio) provides an authentic performance as the maid for a doctor and his upper-middle class family. She has a special bond with his wife ""Sophia"" ((Marina de Tavira) and we follow their rather intimate and caring relationship that defies the glaring gap in their social classes. There is certainly plenty going on, but as with normal life these things progress slowly - if at all - and, unfortunately, that rendered this a bit of long watch with little development with either plot nor character - after a while I became a bit immune to the cinematography and started to want something a bit more substantial as it ends pretty much as it began... This is a timeless piece of cinema, no doubt - but is it great? Hmmm...!"
ROMA,16 December 2018,8/10,"Mexico City, 1970. An upper-middle-class family live a reasonably average, mundane existence. Their maid, Cleo, is an observer to their domestic existence but she has a life of her own. This is her story.Good drama, directed by Alfonso Cuarón (Gravity, Children of Men, Y tu mamá también). Slow-burning yet very engaging. You get sucked in by Cleo's story and feel with her as her life takes its twists and turns.While it's a great drama, there's some quite funny moments too, and a tongue-in-cheek nod by Cuarón to his own film, Gravity.Superb cinematography, with some shots that could be straight out of a photography exhibit.Not particularly powerful or profound though. I kept waiting for the plot to lead to something that tied everything together, a single event that made all the (what appeared to be) build-up worth while. There is an event towards the end that does give meaning to some of what came before but things then quickly go back to the Act 1-like feel.This all said, this movie is not about providing great profundity or a dramatic conclusion. It's about life and its journey, and what an engaging journey it is."
ROMA,21 December 2018,9/10,"I already want to see ""Roma"" again.It took me a good while to settle into the rhythms of Alfonso Cuaron's critically acclaimed new film, and by the time I did I wanted to go back and start it over to see what I might have missed. A lot comes at the viewer in ""Roma,"" and it's hard to take it all in on a first viewing. No...that's the wrong way to put it. Nothing comes at you -- you have to go after it. That's what makes ""Roma"" unique. Cuaron crams his frame in any given scene with tons of movement and sound, but he shoots almost everything in medium and long shots and chooses to pan his camera rather than insert a lot of edits. The result is you have to decide what you want to look at, and while the main protagonist is in virtually every scene, she's not always necessarily the focal point.That protagonist, by the way, is Cleo, maid to a wealthy family and played in a quiet and quietly devastating performance by Yalitza Aparicio. ""Roma"" is an episodic assemblage of scenes that shows what life is like for Cleo, without big showy emotional moments or much editorializing. She's treated fairly well by the family she works for, but make no mistake -- they rarely let her forget she's their employee. The film is a lot about privilege. The family treats Cleo as one of their own when they feel like it or when it's convenient to, but don't when it's not. She's part of their most intimate moments and they her's, but she'll never really be one of them. She has much to take care of, but nothing of her own to really care for. And there's a big wide world out there, the movie makes clear, that will never include people like Cleo.For a while I was a little disappointed that I wasn't feeling ""Roma"" as much as I wanted to and as much as rapturous reviews led me to believe I would. I was engaged by it, but I didn't feel heavily involved emotionally. But then pretty far into the movie something happens to Cleo, and in that moment I realized how invested I was in how things turned out for her. ""Roma"" sneaks up on you in that way.Grade: A"
