Title,Date,Rating,Comments
ROMA,25 July 2020,3/10,"As soon as I noticed this movie was black white and they had a 5 minute scene watching the soap go down the drain, I should have ended it right there. However, it was a mailed DVD so it was more of commitment than streaming so I gave it a go.There are some good things about this movie. I think it was a pretty good depiction of middle upper class city life in Latin America. I am married to a Peruvian and many things were very accurate about the lifestyle, and the house. I also like the nostalgia component since I was a kid in the 70s and even though this movie took place in another country, there were still many familiar enjoyable details. I also found the affection of the family endearing. I also like that they didn't kill any of the major characters, just to torture the audience, which these kinds of artsy movies tend to do. I was waiting for tragedy but it never happened fortunately.The bad thing about this movie is that it lacked any kind of real story or plot, and that it was often super tedious. I don't think claiming that this makes this movie like real life and therefore realistic is a good excuse. I think it's just plain lazy. I have real life already. I watch movies because I want an entertaining story or because I want to experience something new, or learn something. I suppose I did learn some things and have some new experiences with this movie, but watching soap go down the drain or watching a maid take every corner around the house is hardly anything new. It seems like the director is more in love with his camera work than actually caring much about the audience's experience. Can I label camera work pretentious?I feel that somehow this movie was a montage of subtle and not so subtle social statements. Maybe that is the real purpose of this movie. So I am going to list some of what I perceived, with a little sarcasm mixed in1) Clean up after the dog if you want your marriage to last. Well the only thing I remember the husband saying the entire movie was something about there being dog poop all over the place, and there were many shots of the dog poop in the driveway. I think he left because of the poop maybe?2) You can't trust people that do karate naked. Unfortunately, the one scene in the movie that I will probably not forget. Yuck. What is the point really?3) Men are bad. Every adult male in this movie aside from maybe the chauffer, who really didn't have a single line, were astoundingly cold uncaring people. One of the wife's most dramatic lines was something about a woman always being alone. The karate guy boyfriend was also awful.4) Never leave you maid who can't swim to watch the kids at the beach in pounding surf. Duhhh5) The life of a poor maid in Mexico is not all that glamorous. Maybe this is the big reveal. Ha haOverall a very forgettable movie aside from the ""karate"" scene."
ROMA,9 January 2020,10/10,"Cuaron is this generation director, but with this movie I call him Legend along with whom we usually call before generation great directors. Through out movie I saw only passion."
ROMA,28 November 2018,8/10,"I somehow feel compelled to write a review of this film. I'm not quite sure why, though, there are so many out there already... mine is not going to make a difference, but still I feel like writing... something. So, here it goes:The hype surrounding this film is not wrong, it is an exquisite film, in most (cinematic) regards. And still, I did feel that the hype has more to do with the fact that such a beautifully made film is struggling to find screens in the theaters of its own Director's-Editor's-Cinematographer's-Screenwriter's-Producer's country of origin. Don't get me wrong, I'm up for THAT hype as well, but the fact that I listed Cuaron's tasks in this film in a long-hyphened-one-liner is no coincidence. It is a statement on over-indulgence that kind of wants whoever reads this to consider that, maybe... just maybe... he should've entrusted some of these departments to someone else (ehm, screenwriting and/or editing), and the film might have just connected with me. I was constantly trying to find empathy with the characters. And I got very close, but sadly, by the end, I simply didn't. I was so astonished by how perfectly shot the film was, that it didn't really feel like a beautiful film, but rather, a beautifully made film. It's not the same. The first one refers to the story, while the second refers to the craft of making the film. It still got as close as it gets to being overwhelming, though. I think I'm even a little sad that it didn't. Not that Cuarón or anyone else cares.Anyway, watch it, in the theater, or at home, it doesn't matter. Yalitza Aparicio's performance alone is more than worth your time.Here's to my two cents on this Maestro's work of art."
ROMA,28 December 2020,7/10,"Great cinematography!
There is very little story, and it is very slow paced. However it give us a look into the lives of average people, living in 1970's Mexico. Its nothing grand, but that's life. Life sucks sometimes, but we keep on living and see what else the world has in store for us, and I think this film shows that.Definitely not the most entertaining movie ever, but it's a treat for your eyes, has some great performances, and heart breaking moments. Definitely recommend if you enjoy slower movies, or good cinematography."
ROMA,8 January 2019,8/10,"Very natural acting. Well directed and cut. It is a calm slow movie, very intriguing. All in black and white, it's 1970-1971. Lot's of work in the recreation of the details, like old cars, interiors, behavior, buildings, etc. First I thought not a recommendable movie, but then one gets more and more involved into the movie. Beautiful camera work."
ROMA,23 January 2019,3/10,"This movie started off with about ten full minutes of slooooowww credits. It was foreshadowing. Ok, great sounds & textures blah blah blah, what we actually have here is another one of those highbrow ""art"" films that doesn't inspire or entertaine, but people will oooohhh and ahhhh over it because they think they're not getting something that isn't there. I tried three times to get through it. All it succeeded in doing was make me sleepy & want to clean my house simultaneously which is not a good mix- just like this movie."
ROMA,16 December 2018,2/10,Nothing is happening. But this nothing looks good at least...
ROMA,9 January 2019,1/10,Please someone tell me....what was the point of this Empty Movie? What a BORE! What was the Point?
ROMA,12 January 2019,6/10,"I'm probably echoing some of the same points made in other reviews. Visually this film is fantastic. I really enjoyed the camera work and style of the film. That being said, besides a few key scenes in the third act of the film, I found myself pretty bored. I must caveat this by saying, typically this is not a movie I would watch, and isn't my cup of tea. So I would say, if you don't expect to like it, you probably won't."
ROMA,10 May 2020,1/10,It contains art and not suitible for having fun. So I closed after 15 mins.
ROMA,31 January 2019,2/10,"Anyone saying this is the best movie of the year/of the decade/ever is just a complete liar. It has absolutely no qualities to justify any acclaim. Does it have any positive points? Yes, it is beautifully shot, but nothing groundbreaking or to be studied in years to come. The plot starts at nowhere and goes nowhere. That simple. You can't even call it a character study because the characters are presented in a shallow and generic way, they too start at nowhere and go to nowhere. The acting is just average, definitely not worthy of all the nominations. The main character will never really let you know if she's happy, sad, desperate, in love, in fear... She just keeps the same face throughout the way dragged 2:15h running of this waste of life. This could be a short of 15 minutes and it wouldn't make a difference, it would still be pointless. Seriously, don't make the same mistake lots of us did. Do not waste your time on this one."
ROMA,21 February 2019,,"I really like this movie's style, but am I the only person who found it boring? Very little happens and it takes its time not happening. I think maybe the director just made up a lot of the scenes as he went along.There are really bizarre moments, like the dog poop scenes, the astronaut moment, the guy singing to the camera, and the naked guy doing martial arts, Mostly, it is really slow. There are long, extended shots of people walking up stairs, turning off lights, washing floors and dishes, and doing mundane tasks. The dialogue was mainly chit-chat. I don't understand why this won the Oscar. If this is ""Art"" I will pass. but hey It's a free country...:D"
ROMA,27 January 2019,1/10,I expected to love this film. The first scene scared me ... I mean how long can you look at water thrown on the tile floor? It never got better.
ROMA,12 March 2021,9/10,"This movie is so good, and the best exaple of an art film. It has amazing cinematography, the fact that its in black and white adds a lot to the tone and mood; It also had great sound design and the scenary in it was great. It was long, but it felt appropriate, even leaving me wishing it was longer. It's a sad story with no real ending but that's part of its greatness. The acting was very good, the child actors weren't bad at all, and Yalitza's preformance was outstanding, considering she wasn't a proffesional actress before this role. Overall, a groundbreaking film, and one of a favorite movies. It's a great look into the life that Mexico City has, and its working class. it feels alive."
ROMA,24 January 2019,8/10,"I get why the numerous nominations and I get why some people were disappointed by the lack of storytelling.First things first - the cinematography is stellar and poetic. You could pause the movie every 5 seconds and get a stunning photograph. The long takes simply got me.Secondly - yes, there is no epic story here. And you know what? That's exactly how things are in life. This is what this movie is all about - the silent drama of the boring lives we, normal people, go through as we sit on time's sidelines. In the grand schemes of things, we don't matter. Just as Cleo's drama doesn't matter to anyone except her. She's all alone with her struggles, just as we all are."
ROMA,21 January 2019,4/10,"Actually, over-rated really does not give justice to how not good it is but somehow awful, horrible or disaster just do not seem right. Plus there is one really great scene in a hotel room with a bow staff. Just kidding actually the scene and the only memorable part of the movie was the babies birth which was pretty fantastic. Yes, the ""cinematography"" was captivating but almost every other element of a good movie was lacking leaving me bewildered on the IMDB and RT scores."
ROMA,26 January 2019,1/10,"I Had to see it. Nominated, wow, for so many Oscars. I tried. Really tried to get into groove of it, but... Camera work is interesting, the angles, attention to detail, b/w, but that's about it. There is no story, no sense, no fragment is connected to another. I am really wondering if the creator of this ""masterpiece"" was severely stoned in the process. Even bigger question is what kind of substance the Academy has been on to nominate this thing for best picture. I lost 2 hours of my life. If I just stared at the dot in my ceiling for 2 hours, it would have been better."
ROMA,4 March 2019,3/10,"Quite a bit disappointed with Roma movie. It's extremely overrated move, for political reasons I guess. Cinematography is just a OK, this movie is way too long, could be edited to 90 min feature. It's hard to believe this film was even considered by Academy for a Best Feature. It's just another foreign feature film in 70s nostalgia style, it will be forgotten soon."
ROMA,4 March 2019,7/10,You can see why this film was a favourite for Oscar nominations. The directing was undoubtedly superb: shocking and delicate scenes were dealt with tastefully and artistically. The long tracking shots from the perspective of Cleo (the maid) were both well executed and well purposed to allow the audience to experience the film from her perspective. This contributed to a melancholic yet comfortable tone which carries the viewer with ease through a somewhat mundane plot.Overall this film is a good viewing experience which possesses some excellent scenes yet lacks much in the way of entertainment.
ROMA,11 May 2019,9/10,"Many people here are giving it a 1/10, maybe because they want to be different or feel as though the film is over-hyped, but it really is amazing. It's a modern classic, a modern La Dolce Vita, people here are complaining about how slow it is and the lack of story, watch any film by Andrei Tarkovsky, then complain. It's meant to portray real life and it does a great job of it, by far Cuaron's best work. He's definitely learned how to end a film since Children of Men (2006). At some points it is a little slow, but it makes up for it with the visuals and long shots in the most stunning parts of Mexico. Don't listen to the people giving it a 1/10, they write that review with hate, it's not from a place of sense. I believe that the people writing those reviews have never seen any classic film over 2 hours. No film is perfect, but damn is this close."
ROMA,3 January 2019,7/10,"Like Y Tu Mamá También and Children of Men, Cuarón's depth and attention to detail is outstanding. The grayscale makes you appreciate the choice of patterns and shades which enrich each shot. Cuarón has again written awesome and empowering female leads which emphasises how often Hollywood still fails to pass the Bechdel Test on numerous occasions. A film definitely for the enjoyment of its beauty and less on plot, however the final half-hour is incredibly gripping and moved me to the verge of tears."
ROMA,3 December 2018,,"The 10 Star Reviews Are Likely from People Connected to the FilmRoma first came to my attention from an onslaught of PR from Netflix. However, I've been watching the movie for the past 32 minutes and 26 seconds and I'm bored to tears. Where's the story? Where's a modicum of anything worthwhile to keep me viewing?Simply put, don't believe the hype.Sorry Netflix, bombarding voting members like myself doesn't buy you awards. Good films do. Stop throwing everything and the kitchen sink at us hoping that something sticks. You're asking for a negative reaction with such a misguided strategy.AN UPDATE AS OF OSCAR NIGHT:
It turns out Netflix engaged in a behind-the-scenes campaign to smear ""Green Book"", Roma's closest competitor in the race for the Academy's Best Picture award. I can only hope that this untoward and unprofessional behavior comes back to bite Netflix and the film's producers in the behind when the statuettes are handed out tonight.(And as an aside, from here on out, all Netflix screeners that I'm sent during Awards Season will he placed at the bottom of the pile)"
ROMA,14 June 2019,3/10,"I adore films about human. I like dramas. I like ultra slow films, and despise action movies. Yet, apart from the fantastic camera tricks and some very difficult-to-shoot scenes, I have nothing to praise about this film. Honestly speaking , it was simply terrible. Very beautifully shooted, highly aesthetic but pointless and extremely needlessly long scenes are seamed together to create a 2.5 hours long torture. It is obvious for me that the director could not (or did not) balance the cinematography with the content, which is ""cool"" and always well received by the festivals and Oscars, but I feel like I deserve some , tiny bit of content in something I invest 2.5 hours."
ROMA,16 December 2018,5/10,"There was not much of a plot to this film. It is basically about an upper class family in Mexico and their working class housekeeper. The lead actress is interesting but I would not characterize her acting as great or best actress worthy. I like the cinematography, but the lack of a soundtrack did not add anything to the overall quality of the film. I watch a lot of subtitled movies, as this one is, but that doesn't influence my average rating for the film."
ROMA,12 January 2019,10/10,"It took me awhile to get into the film. But it captured me in it's spell. The cinematography/videography is stunning as well as the acting. Beautiful, heartbreaking. Glorious. Magic that slowly casts it's spell."
ROMA,27 January 2019,1/10,"An average 8 rating! I'll admit the movie had good acting and good cinematography, but the story was bad, the pacing was bad, it was boring. I guess I am just not the artistic type. I saw all 8 Best Picture nominees and this one was with The Favourite as the worse."
ROMA,29 January 2019,3/10,"I've seen most of the Oscar nominated films - HATED ""Roma"" - an autobiographical film by a guy who grew up in an upscale household in Mexico City in the 70s with three generations of women (grandmother, mother, sisters) a housemaid and a female cook. Great cinematography. Great acting. Applied to a hyper depressing story. Only men in the film are an unfaithful, absent husband and a violent psycho boyfriend who threatens the life of one of the maids - who is pregnant and loses the baby in a long graphic scene in an emergency room.
My advice: skip it, unless your life is lacking sufficient drama."
ROMA,28 December 2018,8/10,Camera work is amazing. Story is very good. Captivating!
ROMA,29 January 2019,1/10,"Fine. Won't watch it.Blah, blah I guess my review is too short."
ROMA,28 January 2019,2/10,"When I heard that the last movie of Alfonso Cuaron was in black and white, based in his childhood in Mexico, in Spanish, I couldn't wait!!! Maybe it was on me, because I expect so much from this director. After all he is truly one of the best! But this movie is such a disappointment...I can't comprehend...what was the story? The sacrificed of the women? The pain of the children? Why the husband left? It seems to me that none of the stories lines were developed...kind of laziness to expect the viewer to look at the beautiful cinematography and be content!"
ROMA,20 December 2018,10/10,"Wow. From start to finish I watched this movie in its original Español sin subtítulos and it was powerful. From the cinematography to the direction and acting, this movie made me more emotional than any I remember watching. Alfonso Cauron's masterpiece in a long career of greatness. Best picture hands down"
ROMA,6 April 2019,7/10,"I had to put aside my expectation of a beginning, a middle, and an end. There was no ""climax"" to the story, which was very disappointing to many people. It was an experience, and the more I watched, the more I felt like I was there. It was artistic and emotional and just different. I'm glad I watched this movie, it was thought provoking."
ROMA,28 January 2019,2/10,"It's a really slow movie. There is not much of a plot, just a lot of things that happen that are tied together simply by the characters being around them - the awful school band marching down the street, earthquake, the forest fire, the weird dude singing while the fire burns, the rude young people at the movies, etc. None of the things that happen do anything to drive a plot or narrative but rather just seem to drag out the movie. Then there are the ridiculous things you see - all the pregnant women walking around in front of the hospital and several more just sitting in the acting room, yet Cleo gets to the front of the line without wait. The acting is pretty bad - with the exception of when Cleo gives birth, she has no emotions whatsoever. She's got the be the flattest, most one dimensional character not played by George Clooney."
ROMA,24 September 2019,10/10,The film really has this and that kind of concept. The fire extinguishing scene with happy new was marvel. Other than that yhaa thanks for efforts.
ROMA,21 February 2019,4/10,"Now...I am all for some good drama movies without the super hero or mega computer special effects but....and that's a big BUT...when a movie spends the first 10 min showing the camera slowly zooming out from water thrown over a patio in order to clean dog poo...o well, these kind of movies there will always be viewers who ""absolutely love a simple yet dramatic real life story being so beautifully portrayed, the stunning use of camera and the great photography effects"", for other is just a long bore,"
ROMA,22 May 2019,1/10,You know when a movie is boring when you don't care about missing some of the subtitles! Please don't waste 2.5 hours of your life!
ROMA,30 January 2019,10/10,"Truly a beautiful story, told with beautiful cinematography, that shows the beautiful scenery as well as using a colour palette that suits the film's tone, as well as amazing production design and editing, all being used in capturing the film's beauty and realism. The actors all did a phenomenal job as portraying their characters, with giving us incredible emotional moving performances, that helps capture the realism, all in all, creating a believable, life like performance.Overall, this film was absolutely beautiful, a masterpiece. I hope this film dominates the Oscars. It has been nominated for ten Oscars, and this films deserves to win every award it gets nominated."
ROMA,26 January 2019,3/10,"I second what has been written before. Meh, meh... ohhh no... yawn... G.reat acting... Excessive but excellent staging of events. Even with the Turkeys having sex - so yes, the cinematography and artistic value was great - like a painting where you are just staring at it and thinking: ""Wow, they put too much thought and effort into this, despite it being a whole lot of nothing."""
ROMA,25 February 2020,8/10,"I watched the firstv20 minutes of this film in Netflix twice....saying to myself I can see why it got an oscar.. I know what it's all about... I can chalk this one off.. but it was on at our local art cinema and I went out of curiosity to see what It looked like on the big screen.. funnily enough i preferred the cinematography of the first 20 minutes on the TV . But then i got it. And i am a convert... someone re viewed this and said his grandmas story would have been better.. and of course he inadvertently sums up this picture.. this is real person's story not a faux tragedy but a true tragedy... we see the tragedy of the domestic' s life and the tragedy of the self obsessed middle class wife's lives converge... while other narratives cross cross... the idiot lothario martial artist the selfish husband.. the riots, the violence and if you didn't get that from this film then what you want from cinema is the reason the US film industry make shallow dramas.. thank God for whatever political manoeuvres that the oscar academy realised this was a human story and that the director told it in a thoughtful way..."
ROMA,29 March 2019,10/10,"What sets Roma apart from Alfonso Cuarón's impeccable library of films is how flawlessly he's mastered his visual craft into telling his most personal story to date.His career has sailed high and mighty as one of 21st century's most enthralling visual storyteller, giving us defining and revolutionary films such as Children of Men (personal favourite) and Gravity. This time, Alfoson Cuarón grounds himself in a different reality, with a story that embellishes in his signature visual dazzle, rendering an emotional truth to a subject matter that can only feel but personally attached to the filmmaker himself.Spanning one year, from 1970 to 1971, Roma tells the story of a live-in maid working for a middle-class family in Mexico City. From the very beginning, Alfonso pulls you in, immersing the viewer into a real intimacy with the family that will last till the end credits. Through emotional highs and lows, the narrative takes on different directions as it sweeps, tracks and pans to give visually engrossing sequences and moments that will imprint in your memory.Roma couldn't have been told if not for a wonderful cast of actors led by the magnificent Yalitza Aparicio, who gives the story its core and melts it with a beautifully heartfelt ending. The ensemble are perfect, showing all colours of life in an array of platitudes old and familiar.It comes to no surprise that I give Roma the praise it deserves, with 10 Oscar nominations under its belt, it truly is the best picture of the year."
ROMA,23 April 2019,,"After sitting patiently through mop water and car tires navigating. I was just relieved it was over, and I wish I could get my time back. Artsy, but it ruined our night. The plot comes to a surprisingly uneventful ending that left us wondering what just happened. The answer is, nothing. I'm not sure which movie the critics were watching to give it such a high rating."
ROMA,26 January 2019,4/10,"It's just not good, and with nearly 60k people who gave it average 8 of 10, i can see my opinion is completely different than others.
It's difficult to explain, I didn't like it because:
facts are just unconnected, just keep happening, as if you're living that sad life - maybe that was the goal of the director but it's not something I choose to watcheven the scenes of most intense dramas are difficult to connect to, no empathy for the maid, or for the lady of the house or for the children or dog or for the deaths - they are just there, like many separate scenes being put together to fill the 2h time of the movieI gave it 4 of 10 and not less, as scenes, especially this black and white, reflect well the 70's."
